{
    "$schema": "http://json-schema.org/draft-07/schema#",
    "$id": "distro.json",
    "title": "The Distro Manifest Schema",
    "type": "object",
    "properties": {
        "name": {
            "description": "The name of the distro",
            "type": "string"
        },
        "machine": {
            "description": "The machine type",
            "type": "string"
        },
        "version": {
            "type": "object",
            "properties": {
                "major": {
                    "type": "number"
                },
                "minor": {
                    "type": "number"
                },
                "patch": {
                    "type": "number"
                },
                "build": {
                    "type": "number"
                },
                "variant": {
                    "type": "string",
                    "enum": [
                        "ota",
                        "bootc",
                        "dev",
                        "prod"
                    ]
                },
                "codename": {
                    "type": "string"
                }
            },
            "required": [
                "major",
                "minor",
                "patch",
                "build"
            ]
        },
        "debian": {
            "description": "The Debian release used as base. Only the recipe under recipes-debian with this name is included, the other Debian release recipes are excluded",
            "type": "string",
            "enum": [
                "bookworm",
                "trixie",
                "forky"
            ],
            "default": "bookworm"
        },
        "maxImgSize": {
            "type": "number"
        },
        "arch": {
            "type": "string",
            "enum": [
                "linux/amd64",
                "linux/arm64"
            ]
        },
        "searchForRecipesOn": {
            "type": "array",
            "items": {
                "type": "string"
            }
        },
        "excludeRecipes": {
            "type": "array",
            "items": {
                "type": "string"
            }
        },
        "includeRecipes": {
            "type": "array",
            "items": {
                "type": "string"
            }
        },
        "useInitramfs": {
            "type": "boolean",
            "default": true
        }
    },
    "allOf": [
        {
            "if": {
                "properties": {
                    "includeRecipes": {
                        "type": "array"
                    }
                },
                "required": [
                    "includeRecipes"
                ]
            },
            "then": {
                "not": {
                    "required": [
                        "excludeRecipes"
                    ]
                }
            },
            "else": {
                "if": {
                    "properties": {
                        "excludeRecipes": {
                            "type": "array"
                        }
                    },
                    "required": [
                        "excludeRecipes"
                    ]
                },
                "then": {
                    "not": {
                        "required": [
                            "includeRecipes"
                        ]
                    }
                }
            }
        },
        {
            "dependentSchemas": {
                "includeRecipes": {
                    "properties": {
                        "excludeRecipes": false
                    },
                    "errorMessage": "Cannot use 'includeRecipes' and 'excludeRecipes' together."
                },
                "excludeRecipes": {
                    "properties": {
                        "includeRecipes": false
                    },
                    "errorMessage": "Cannot use 'excludeRecipes' and 'includeRecipes' together."
                }
            }
        },
        {
            "oneOf": [
                {
                    "required": [
                        "includeRecipes"
                    ]
                },
                {
                    "required": [
                        "excludeRecipes"
                    ]
                }
            ]
        }
    ],
    "required": [
        "name",
        "machine",
        "version",
        "maxImgSize",
        "arch",
        "searchForRecipesOn"
    ]
}
