{
    "name": "DeimOS-Reference",
    "machine": "qemuarm64",
    "arch": "linux/arm64",
    "version": {
        "major": 0,
        "minor": 4,
        "patch": 0,
        "build": 0
    },
    "maxImgSize": 3072,
    "useInitramfs": true,
    "searchForRecipesOn": [
        "cookbook"
    ],
    "excludeRecipes": [
        "grub",
        "u-boot-ram",
        "microsoft",
        "docker",
        "powershell",
        "simple-splash"
    ],
    "$schema": "./schema/distro-core.json"
}
