{
    "name": "DeimOS-Reference",
    "machine": "qemux86-64",
    "arch": "linux/amd64",
    "debian": "forky",
    "version": {
        "major": 0,
        "minor": 4,
        "patch": 0,
        "build": 0
    },
    "maxImgSize": 1524,
    "useInitramfs": true,
    "searchForRecipesOn": [
        "cookbook"
    ],
    "excludeRecipes": [
        "u-boot-ram",
        "microsoft",
        "docker",
        "powershell",
        "neofetch",
        "simple-splash"
    ],
    "$schema": "./schema/distro-core.json"
}
